,book_title,book_authors,genres,book_rating_count,book_rating,rec_score
17760,Complete Shorter Fiction,"Oscar Wilde, Isobel Murray","Classics, Short Stories, Fiction, Literature, Literature, 19th Century",-0.23494352164815166,0.658436980305408,0.10349219371102888
23248,The Complete Science Fiction Treasury of H.G. Wells,H.G. Wells,"Science Fiction, Fiction, Classics, Literature",-0.23434970187430515,0.5092144020124599,0.10348394518183668
5119,The Pickwick Papers,Charles Dickens,"Classics, Fiction, Literature",-0.15973546594868535,-0.5726492906114126,0.10347343938641106
2730,One Summer,David Baldacci,"Fiction, Romance",-0.16502905669580378,-0.9457057363437826,0.10347148920218935
1118,Uncle Tom's Cabin,"Harriet Beecher Stowe, Ann  Douglas","Classics, Fiction, Historical, Historical Fiction, Literature",0.4279429612893445,-0.4980380014649386,0.10344113196047626
16540,The Love Song of J. Alfred Prufrock and Other Poems,T.S. Eliot,"Poetry, Classics, Fiction, Literature",-0.1818318122702365,1.2553272934772002,0.10334118025905946
960,La señora Dalloway,Virginia Woolf,"Classics, Fiction, Literature, Novels",0.480308489240913,-0.7218718689043606,0.10331899717340064
2315,بابا لنگ دراز,"Jean Webster, محسن سلیمانی","Classics, Fiction, Young Adult, Romance, Historical, Historical Fiction",-0.11513256885654435,0.4346031128659843,0.1033110062016774
11926,A Thousand Tomorrows,Karen Kingsbury,"Christian Fiction, Christian, Fiction, Romance",-0.22170368471679788,1.2553272934772002,0.10322813780006682
4223,Sons and Lovers,"D.H. Lawrence, Geoff Dyer","Classics, Fiction, Literature",-0.08138641618229422,-1.3560678266493889,0.1032118911508233
7293,"Look Homeward, Angel",Thomas Wolfe,"Fiction, Classics, Literature, Novels",-0.20020897158717016,-0.16228720030580626,0.10321007076806232
309,The Count of Monte Cristo,"Alexandre Dumas, Lorenzo Carcaterra","Classics, Fiction, Historical, Historical Fiction, Adventure, Literature",2.3190909525017767,0.919576492318068,0.1032079319446518
12156,Now We Are Six,"A.A. Milne, Ernest H. Shepard","Poetry, Childrens, Classics, Fiction",-0.17662807583100276,1.4418555163433844,0.10320581802587056
18724,The Mysterious Stranger and Other Stories,"Mark Twain, Howard Mittelmark, Jeffrey Nichols","Fiction, Short Stories, Classics, Literature, Humor",-0.23938935653392346,0.2107692454265639,0.10315831407806964
3308,Tarzan of the Apes,Edgar Rice Burroughs,"Classics, Fiction, Adventure, Fantasy",-0.10585804159923136,-0.3488154231719905,0.10315803741272433
416,Crime and Punishment,"Fyodor Dostoyevsky, Leonard Stanton, James D. Hardy Jr., Sidney Monas, Robin Feuer Miller","Classics, Fiction, Cultural, Russia, Literature, Literature, Russian Literature",1.7396517746258668,0.8076595585983559,0.10310960339000735
12877,The Wapshot Chronicle,"John Cheever, Rick Moody","Fiction, Classics, Literature",-0.22051995187814336,-0.8337888026240724,0.10308793405482777
769,House of Leaves,Mark Z. Danielewski,"Horror, Fiction, Fantasy, Mystery",0.14928131228476132,0.5092144020124599,0.10304754466748103
9250,To a God Unknown,"John Steinbeck, Robert DeMott","Fiction, Classics, Literature, Novels",-0.21427703083467825,-0.1995928448790424,0.10304266818973534
9012,Purgatorio,"Dante Alighieri, Robert M. Durling","Classics, Poetry, Fiction, Literature",-0.169916349702922,0.1361579562800882,0.10297192374492203
19068,The Cantos,Ezra Pound,"Poetry, Classics, Fiction, Literature",-0.2255556998287232,-0.23689848945228026,0.10292083611530234
6522,The Garden of Eden,Ernest Hemingway,"Classics, Fiction, Literature, Novels",-0.1859533903058158,-0.9084000917705448,0.10291919909647049
8403,A Christmas Carol and Other Christmas Writings,"Charles Dickens, Michael Slater","Classics, Fiction, Holiday, Christmas, Short Stories, Literature",-0.11579670939308323,0.5465200465856962,0.10290521431187517
14135,The Selected Poetry of Rainer Maria Rilke,"Rainer Maria Rilke, Stephen Mitchell, Robert Hass","Poetry, Classics, European Literature, German Literature, Literature, Fiction",-0.1974000477885147,1.5537724500630965,0.10290067744056045
10076,Growth of the Soil,Knut Hamsun,"Fiction, Classics, Literature, European Literature, Scandinavian Literature",-0.22084420872833585,0.956882136891304,0.10290032989702544
11202,Dream Story,"Arthur Schnitzler, J.M.Q. Davies, Frederic Raphael","Fiction, Classics, European Literature, German Literature, Literature",-0.2146364480662169,-0.7591775134775984,0.102896516151982
1172,As I Lay Dying,William Faulkner,"Classics, Fiction, Literature, Novels",0.22563794044153596,-0.9830113809170188,0.1028815639705694
9561,The Call of the Wild and White Fang,"Jack London, Scott McKowen","Classics, Fiction, Adventure, Animals",0.019910642476033184,0.3972974682927481,0.10286297036683248
9562,The Call of the Wild/White Fang,Jack London,"Classics, Fiction, Adventure, Animals",0.01982469487718698,0.3972974682927481,0.10286297036683248
4100,The Bridge of San Luis Rey,Thornton Wilder,"Fiction, Classics, Historical, Historical Fiction, Literature",-0.1415341085384826,-0.6845662243311244,0.10282710145464921
3909,Fikcje,"Jorge Luis Borges, Jacek Sobol-Jurczykowski","Fiction, Short Stories, Classics, Magical Realism, Literature, Fantasy",-0.08880525664633694,1.7776063175025167,0.10280587317772968
3917,Ficciones,"Jorge Luis Borges, Anthony Kerrigan, Anthony Bonner","Fiction, Short Stories, Classics, Magical Realism, Literature, Fantasy",-0.08899668538922166,1.7776063175025167,0.10280421929402545
20151,Go,John Clellon Holmes,"Fiction, Classics, Novels, Literature",-0.2390025923391155,-0.6845662243311244,0.10270608064337575
23274,Poems and Prose,"Gerard Manley Hopkins, W.H. Gardner","Poetry, Classics, Fiction, Literature, Literature, 19th Century",-0.2336504009564201,0.8822708477448284,0.1026808243128697
1462,The Jungle,"Upton Sinclair, Earl Lee, Kathleen DeGrave","Classics, Fiction, Historical, Historical Fiction, Literature",0.21248795781806684,-0.9457057363437826,0.10268023631550283
16277,Earthly Powers,Anthony Burgess,"Fiction, Classics, Literature, Religion, Novels",-0.2356311024389213,0.6211313357321718,0.10263609788972508
6161,Last Exit to Brooklyn,"Hubert Selby Jr., Gilbert Sorrentino","Fiction, Classics, New York, Literature, American, Novels",-0.16893185902522911,-0.16228720030580626,0.102635744508953
5453,The Foundation Trilogy,Isaac Asimov,"Science Fiction, Fiction, Classics",0.07092835580933171,1.5537724500630965,0.10260777750204797
418,Crime and Punishment: A New Translation,"Fyodor Dostoyevsky, Michael R Katz","Classics, Fiction, Cultural, Russia, Literature, Literature, Russian Literature",1.7396517746258668,0.8076595585983559,0.10257968591628502
16446,Omensetter's Luck,William H. Gass,"Fiction, Literature, American, Literature, Novels, Classics",-0.2386392683985384,0.09885231170685202,0.1025655818438432
16649,The Man Without Qualities: Vol. 1,"Robert Musil, Burton Pike, Sophie Wilkins","Fiction, Classics, Literature, European Literature, German Literature",-0.23525605837122876,1.4045498717701483,0.10255258400875215
5056,The Complete Stories,Flannery O'Connor,"Short Stories, Fiction, Classics, Literature, American, Southern",-0.1219458694196252,1.7029950283560444,0.10253154473262488
9487,The Adventures of Tom Sawyer & Adventures of Huckleberry Finn,Mark Twain,"Classics, Fiction, Adventure, Literature",-0.10521734131692327,0.35999182371951194,0.10251931257048397
57,A Thousand Splendid Suns,Khaled Hosseini,"Fiction, Historical, Historical Fiction",3.5123639746282316,1.3672442271969087,0.10245339191579958
20167,A Jest of God,"Margaret Laurence, Margaret Atwood","Fiction, Cultural, Canada, Classics, Literature, Canadian Literature",-0.235283405334498,-0.16228720030580626,0.10242663111285766
11957,Christ Recrucified,"Nikos Kazantzakis, Jonathan Griffin, Nikos Kazantzakis","Fiction, Classics, Novels, Literature",-0.2262432806194928,1.0687990706110126,0.10237639364174068
11779,Night and Day,"Virginia Woolf, Julia Briggs","Classics, Fiction",-0.21711330159660291,-0.8710944471973087,0.10235667638276444
14397,The Abortion,Richard Brautigan,"Fiction, Novels, Literature, Romance",-0.227567654983532,0.3226861791462757,0.10232607952924413
22918,A Gangster's Girl,Chunichi Knott,"Urban, Fiction",-0.2348419472131516,1.7403006729292805,0.10231212646619375
19369,Self-Portrait in a Convex Mirror,John Ashbery,"Poetry, Literature, American, Classics, Literature",-0.2308453838668031,0.3972974682927481,0.10228949906712223
14274,Framley Parsonage,Anthony Trollope,"Classics, Fiction, Historical, Victorian, Literature, 19th Century, Literature",-0.2330253275102659,0.1361579562800882,0.10225493947090111
1185,The House of the Spirits,"Isabel Allende, Magda Bogin","Fiction, Magical Realism, Historical, Historical Fiction, Classics, Fantasy",0.3612671581298831,0.8449652031715923,0.10222773750224678
22,The Alchemist,"Paulo Coelho, Alan R. Clarke, James Noel Smith","Fiction, Classics, Fantasy, Philosophy",6.183978670708804,-0.5353436460381764,0.1022083290480344
303,The Stranger,"Albert Camus, Matthew Ward","Classics, Fiction, Philosophy, Cultural, France, Literature",1.9290802824828988,-0.05037026658609438,0.1021908967792543
91,If I Stay,Gayle Forman,"Young Adult, Romance, Contemporary, Fiction",2.228252153939417,-0.1249815557325684,0.10218201920081973
9054,Even Now,Karen Kingsbury,"Christian Fiction, Christian, Fiction, Romance",-0.1654705148171502,1.0314934260377764,0.1021745604618064
24,The Night Circus,Erin Morgenstern,"Fantasy, Fiction, Romance, Historical, Historical Fiction",1.8575640668247808,0.2107692454265639,0.10213072475657284
20970,Kiss Heaven Goodbye,Tasmina Perry,"Womens Fiction, Chick Lit, Fiction, Romance",-0.2392916888079618,-0.2742041340255165,0.10208883909622854
74,Animal Farm,George Orwell,"Classics, Fiction, Science Fiction, Dystopia, Fantasy, Literature",8.494480623528016,-0.3115097785987543,0.10207249854895906
269,Little Women,"Louisa May Alcott, Louis Jambor","Classics, Fiction, Historical, Historical Fiction, Young Adult, Romance, Historical, Literature, Childrens, Classics, Classic Literature, Literature, 19th Century",5.343794011478706,0.2480748899998001,0.10205668565841094
4991,The Lady of the Camellias,Alexandre Dumas fils,"Classics, Fiction, Romance, Cultural, France, European Literature, French Literature",-0.14217480882079067,-0.013064622012858192,0.10204943734844459
11262,When We Were Very Young,"A.A. Milne, Ernest H. Shepard","Poetry, Childrens, Classics, Fiction",-0.1643610094502265,1.2180216489039608,0.10197621283813835
22677,"Remembrance of Things Past: Volume III - The Captive, The Fugitive, & Time Regained","Marcel Proust, C.K. Scott Moncrieff, Terence Kilmartin","Fiction, Classics, Literature, Cultural, France",-0.2419795046264249,2.225274052381361,0.10197424328324386
1761,White Noise,Don DeLillo,"Fiction, Classics, Literature, Novels, Literature, American",0.056106301717400116,-0.4607323568917023,0.10195368992224607
2,Nestala,"Gillian Flynn, Tatjana Jambrišak","Fiction, Mystery, Thriller, Mystery, Crime",6.987705921191957,0.2480748899998001,0.1019414238110623
9563,Selected Stories,"Anton Chekhov, Richard Pevear, Larissa Volokhonsky","Short Stories, Fiction, Classics, Cultural, Russia, Literature, Russian Literature, Literature",-0.13712734074309546,1.4418555163433844,0.10190438488174652
9569,Selected Stories of Anton Chekhov,"Anton Chekhov, Richard Pevear, Larissa Volokhonsky","Short Stories, Fiction, Classics, Cultural, Russia, Literature, Russian Literature, Literature",-0.137123434034057,1.4418555163433844,0.10190438488174652
9221,The Graduate,Charles Webb,"Fiction, Classics",-0.2158279943229484,-2.102180718114129,0.10190135784474408
2326,Notes from Underground,"Fyodor Dostoyevsky, Richard Pevear, Philip Dossick, Larissa Volokhonsky","Classics, Fiction, Cultural, Russia, Philosophy, Literature, Russian Literature, Literature",-0.047788718451505695,0.6957426248786442,0.10188031300865089
8828,Joy in the Morning,Betty  Smith,"Fiction, Classics, Historical, Historical Fiction, Romance",-0.22228969107256746,-0.3488154231719905,0.10186543628783024
22322,Little Wizard Stories of Oz,L. Frank Baum,"Fantasy, Classics, Fiction, Childrens",-0.2413856848525784,-0.8337888026240724,0.10175280780143212
12924,Miguel Street,V.S. Naipaul,"Fiction, Short Stories, Literature, Classics",-0.2331229952362275,-0.16228720030580626,0.1017527213326671
427,The Sun Is Also a Star,Nicola Yoon,"Young Adult, Contemporary, Romance, Fiction",0.1004318224678102,0.4719087574392238,0.1017491035451347
14823,The Stories of Vladimir Nabokov,Vladimir Nabokov,"Short Stories, Fiction, Cultural, Russia, Classics, Literature",-0.2202425755364124,1.1434103597574885,0.10172104295806805
16,Ready Player One,Ernest Cline,"Science Fiction, Fiction, Young Adult, Science Fiction, Dystopia, Fantasy",2.2781955222871377,1.1434103597574885,0.10169994315495842
9724,Summer Crossing,Truman Capote,"Fiction, Classics, Romance, Literature, American",-0.2210082905079513,-2.027569428967656,0.10164508367178238
8919,The Complete Novels,Jane Austen,"Romance, Classics, Historical, Historical Fiction, Fiction",-0.1525940018263736,2.113357118661649,0.10157837354472793
11042,خرمگس,"Ethel Lilian Voynich, خسرو همایون‌پور, J.M. Gaffney","Classics, Fiction, Novels, Literature",-0.21691796614467976,0.658436980305408,0.10157452988174
95,Eclipse,Stephenie Meyer,"Young Adult, Fantasy, Romance, Paranormal, Vampires, Fiction",4.6232054360431,-1.0949283146367308,0.10156431741082743
11277,Letters from the Earth: Uncensored Writings,"Mark Twain, Bernard DeVoto, Henry Nash Smith","Fiction, Classics, Humor, Religion, Short Stories, Literature",-0.2184806497600653,0.919576492318068,0.10153601613989113
15682,Leap of Faith,Danielle Steel,"Romance, Fiction",-0.22663785823237764,-1.1322339592099668,0.10151734076977273
6791,Twelve Angry Men,"Reginald Rose, David Mamet","Plays, Classics, Fiction, Drama, Academic, School",-0.16754888402561294,0.35999182371951194,0.1015157739477737
4417,Ask the Dust,"John Fante, Charles Bukowski","Fiction, Classics, Novels, Literature, American, Literature",-0.1533362765436817,0.5465200465856962,0.10150746104918362
11049,The Gadfly,Ethel Lilian Voynich,"Classics, Fiction, Novels, Literature",-0.2169140594356413,0.658436980305408,0.10148855716620615
13179,Hangover Square,Patrick Hamilton,"Fiction, Classics",-0.2321892917760347,0.6211313357321718,0.10148357387549745
11076,"Go Down, Moses",William Faulkner,"Fiction, Classics, Short Stories, Literature",-0.21209318048217696,-0.1995928448790424,0.10146197063528062
28,Eleonora & Park,Rainbow Rowell,"Young Adult, Romance, Contemporary, Fiction",2.467053650624554,0.3972974682927481,0.10144609468144193
13287,The Divan,Hafez,"Poetry, Classics, Literature",-0.2186173845764115,2.411802275247545,0.10144132349683091
18473,Tell Me a Riddle,Tillie Olsen,"Short Stories, Fiction, Classics, Literature, Womens",-0.238197810277192,0.28538053457303625,0.10143773665408456
21103,Time Will Darken It,William Maxwell,"Fiction, Novels, Literary Fiction, Classics, Literature",-0.24237798894834825,0.28538053457303625,0.10142632598889682
665,Redeeming Love,Francine Rivers,"Christian Fiction, Christian, Fiction, Romance, Historical, Historical Fiction, Historical",0.4433705552822379,1.8895232512222289,0.10138761041556638
467,Safe Haven,Nicholas Sparks,"Romance, Fiction, Womens Fiction, Chick Lit, Contemporary",0.9286619520402088,0.8076595585983559,0.10138390002884261
1681,Housekeeping,Marilynne Robinson,"Fiction, Novels, Literary Fiction, Literature, Classics",-0.11113600551019592,-0.6099549351846504,0.10131222291717468
9551,The Book of Sand and Shakespeare's Memory,"Jorge Luis Borges, Norman Thomas di Giovanni","Short Stories, Fiction, Literature, Classics, Magical Realism",-0.21095242144294554,0.6211313357321718,0.10130731404154522
7901,Being There,Jerzy Kosiński,"Fiction, Humor, Classics, Novels, Literature",-0.2087021570367904,-0.4234267123184645,0.10130316723671083
2845,The Dharma Bums,Jack Kerouac,"Fiction, Classics, Literature, Novels",0.03764319480162029,-0.16228720030580626,0.10129284907672216
2629,Chess Story,"Stefan Zweig, Peter Gay, Joel Rotenberg","Fiction, Classics, European Literature, German Literature, Short Stories, Literature",-0.0758545161838295,1.1434103597574885,0.10127135876076507
2381,La Divina Comedia,"Dante Alighieri, Abilio Echeverría, Carlos Alvar Ezquerra","Classics, Poetry, Fiction, Literature",0.13393966589071404,0.3226861791462757,0.10125746020795623
8471,Songs of Innocence and of Experience,William Blake,"Poetry, Classics, Literature, Literature, 18th Century, Fiction",-0.11368708651231275,0.4719087574392238,0.10120024985402915
679,The Best of Me,Nicholas Sparks,"Romance, Fiction, Womens Fiction, Chick Lit, Contemporary, Adult",0.25912234361020897,-0.23689848945228026,0.10119796403986916
2358,My Cousin Rachel,Daphne du Maurier,"Classics, Fiction, Mystery, Historical, Historical Fiction, Gothic, Romance",-0.13047421525059166,-0.16228720030580626,0.10116014597208221
18283,The Complete Saki,"Saki, Noël Coward","Short Stories, Fiction, Classics, Humor, Literature",-0.2364436979189217,1.4418555163433844,0.10115528367074399
6607,"The Sea, the Sea","Iris Murdoch, Mary Kinzie","Fiction, Classics",-0.19119228712639572,-0.2742041340255165,0.10113714440614967
10553,Paradiso,"Dante Alighieri, Dorothy L. Sayers, Barbara Reynolds","Classics, Poetry, Fiction, Literature",-0.19004762137812586,-0.1249815557325684,0.10113253197935873
8674,"Will You Please Be Quiet, Please?",Raymond Carver,"Short Stories, Fiction, Classics, Literature, American",-0.1988142764604386,1.0687990706110126,0.10113040906938017
7737,"Other Voices, Other Rooms",Truman Capote,"Fiction, Classics, Literature, Literature, American",-0.20044728083851646,-0.6472605797578865,0.10112910924307977
2635,Ham on Rye,Charles Bukowski,"Fiction, Classics, Novels, Literature, Literature, American",0.025172979550843896,0.658436980305408,0.10112634209252322
10538,The Guermantes Way,"Marcel Proust, Mark Treharne, Christopher Prendergast","Fiction, Classics, Cultural, France, European Literature, French Literature",-0.22251237348775987,1.2180216489039608,0.10112274447135643
17981,The Hogwarts Library,J.K. Rowling,"Fiction, Fantasy",-0.2276145354919936,1.926828895795465,0.10107436641035389
818,The Brothers Karamazov: A Novel in Four Parts and an Epilogue,"Fyodor Dostoyevsky, David McDuff","Classics, Fiction, Cultural, Russia, Literature, Literature, Russian Literature",0.5230127257403605,1.2553272934772002,0.10106313225578133
5978,Babbitt,Sinclair Lewis,"Fiction, Classics, Literature, Literature, American",-0.1693537836013832,-1.2441508929296787,0.10105953532344741
371,Atlas Shrugged,"Ayn Rand, Leonard Peikoff","Fiction, Classics, Philosophy, Literature, Politics",1.0086752598569857,-1.1322339592099668,0.1010403583386802
18861,"Little Women, Little Men, Jo's Boys","Louisa May Alcott, Elaine Showalter","Classics, Fiction, Literature, Childrens, Literature, American, Romance, Literature, 19th Century, Young Adult, Historical, Historical Fiction, Historical",-0.2291029916356483,1.2180216489039608,0.10099944360588392
9385,Dombey and Son,"Charles Dickens, Jonathan Lethem","Classics, Fiction, Literature, 19th Century, Literature",-0.1963764900204372,-0.2742041340255165,0.10099342085062044
8427,Appointment in Samarra,John O'Hara,"Fiction, Classics, Novels, Literature",-0.19619678140466784,-0.5726492906114126,0.10097467251678577
18981,Hating Alison Ashley,Robin Klein,"Young Adult, Fiction, Childrens",-0.2319041020162268,-1.8410412061014692,0.10094399546961419
18690,A Baby's Cry,Cathy Glass,"Nonfiction, Sociology, Abuse, Autobiography, Memoir, Family Law, Fostering",-0.2336269607021893,0.919576492318068,0.10094209171862785
2509,Zorba the Greek,"Nikos Kazantzakis, Carl Wildman","Fiction, Classics, Philosophy, Novels, Literature",-0.13355660868193955,0.3972974682927481,0.10092618045929135
876,"Blood Meridian, or the Evening Redness in the West","Cormac McCarthy, Harold Bloom","Fiction, Westerns, Historical, Historical Fiction, Classics, Literature, Novels",0.1062450055170443,0.7330482694518804,0.10091579777497553
875,Blood Meridian: Or the Evening Redness in the West,Cormac McCarthy,"Fiction, Westerns, Historical, Historical Fiction, Classics, Literature, Novels",0.1062450055170443,0.7330482694518804,0.10091579777497553
11746,The Earthsea Quartet,Ursula K. Le Guin,"Fantasy, Fiction, Young Adult, Classics",-0.2151326001141018,1.0314934260377764,0.10090132301964652
19389,Complete Illustrated Lewis Carroll,"Lewis Carroll, John Tenniel","Poetry, Childrens, Classics, Literature, Fiction",-0.2330136073831505,1.4418555163433844,0.10088418256487441
1977,The House of Mirth,"Edith Wharton, Anna Quindlen","Classics, Fiction, Literature, Historical, Historical Fiction",0.03955357552142908,-0.1249815557325684,0.1008819882806738
1606,Chronicle of a Death Foretold,"Gabriel García Márquez, Gregory Rabassa","Fiction, Classics, Magical Realism, Literature, Academic, School",0.1258332446359017,-0.08767591115933222,0.10088121184440063
2003,Mean Streak,Sandra Brown,"Mystery, Romance, Romantic Suspense, Romance, Fiction, Suspense, Thriller",-0.10422503722115348,0.2107692454265639,0.10086473365918164
12753,The Blithedale Romance,Nathaniel Hawthorne,"Classics, Fiction, Literature, 19th Century, Literature",-0.2270597828085317,-2.3260145855535512,0.10077572919736927
290,The Notebook,Nicholas Sparks,"Romance, Fiction, Womens Fiction, Chick Lit, Contemporary",4.229760768779412,0.3226861791462757,0.10076239022148271
17749,The North China Lover,"Marguerite Duras, Leigh Hafrey","Fiction, Cultural, France, Romance, Literature, Classics",-0.2370297042746913,-0.3861210677452283,0.10071985965099739
34,Water for Elephants,Sara Gruen,"Fiction, Historical, Historical Fiction, Romance, Historical",4.442070871474727,0.35999182371951194,0.10071693986589039
10031,The Ambassadors,"Henry James, Harry Levin","Classics, Fiction, Literature, Literature, American",-0.2039789458092877,-1.2441508929296787,0.10068517533052125
7139,Tom Jones,Henry Fielding,"Classics, Fiction, Literature, Literature, 18th Century",-0.13068908424770714,-0.9457057363437826,0.10067433238309059
29,The Giver,Lois Lowry,"Young Adult, Fiction, Classics, Science Fiction, Dystopia, Science Fiction",5.434523422187989,0.5092144020124599,0.10064764423736985
125,Le Petit Prince,Antoine de Saint-Exupéry,"Classics, Fiction, Fantasy, Childrens",3.7753909740608815,1.1434103597574885,0.10063473387278518
20012,Selected Non-Fictions,"Jorge Luis Borges, Suzanne Jill Levine, Esther Allen, Eliot Weinberger","Nonfiction, Writing, Essays, Philosophy, Literature, Criticism, Literary Criticism, European Literature, Spanish Literature, Classics, Cultural, Latin American, History, Reference",-0.2366507534979603,1.6656893837828048,0.1006326528874091
4658,Here on Earth,Alice Hoffman,"Fiction, Romance",-0.08011282903575502,-1.1322339592099668,0.10060188534189665
19537,"The Mortal Instruments, the Complete Collection: City of Bones; City of Ashes; City of Glass; City of Fallen Angels; City of Lost Souls; City of Heavenly Fire",Cassandra Clare,"Fantasy, Young Adult, Romance",-0.2351701107723825,2.449107919820781,0.10059735301859607
7883,The Smoke Jumper,Nicholas Evans,"Fiction, Romance, Contemporary, Drama",-0.13386133198693975,0.2480748899998001,0.10058076864593499
17474,Freedom or Death,"Nikos Kazantzakis, Νίκος Καζαντζάκης","Fiction, Literature, Classics, Cultural, Greece",-0.23727973365315294,0.8449652031715923,0.10055553854425578
6758,The Old Curiosity Shop,"Charles Dickens, Norman Page","Classics, Fiction, Literature, Literature, 19th Century, Historical, Victorian, European Literature, British Literature, Historical, Historical Fiction, Novels, Classics, Classic Literature, Literature, English Literature",-0.18560569320139253,-0.7964831580508346,0.10054645887416361
9057,Freckles,Gene Stratton-Porter,"Classics, Fiction, Young Adult, Historical, Historical Fiction, Romance",-0.2085849557656365,0.3972974682927481,0.10052723756193108
17294,USA: The 42nd Parallel / 1919 / The Big Money,"John Dos Passos, Daniel Aaron, Townsend Ludington","Fiction, Classics, Literature, Literature, American",-0.2278098709439168,0.4346031128659843,0.10052035508797666
6250,A Bear Called Paddington,"Michael Bond, Peggy Fortnum","Childrens, Classics, Fiction",0.022184347136419102,0.8822708477448284,0.10037271215966477
3310,Light in August,William Faulkner,"Fiction, Classics, Literature, Literature, American",-0.0581649376576655,-0.16228720030580626,0.10035836349437666
19639,The Valley of the Moon,Jack London,"Classics, Fiction, Literature, Literature, American",-0.2401785117596931,-0.013064622012858192,0.10034473961940688
9777,Jacob's Room,Virginia Woolf,"Classics, Fiction",-0.217484438955257,-1.6918186278085232,0.1003396160324057
14688,The Last Chronicle of Barset,"Anthony Trollope, Sophie Gilmartin","Classics, Fiction, Literature, Literature, 19th Century",-0.22645424290756985,0.6211313357321718,0.10032507012452331
4615,Anybody Out There?,Marian Keyes,"Womens Fiction, Chick Lit, Fiction, Romance",-0.03709996252226879,-0.2742041340255165,0.10031672778788066
3726,The Rum Diary,Hunter S. Thompson,"Fiction, Classics, Novels, Literature",-0.06248575785420645,-0.5726492906114126,0.10030798549782961
18126,To Build a Fire and Other Stories,Jack London,"Fiction, Classics, Short Stories, Adventure, Literature",-0.22924753987007146,0.2480748899998001,0.10028868868861315
877,All Quiet on the Western Front,"Erich Maria Remarque, A.W. Wheen","Classics, Fiction, Historical, Historical Fiction, War, Literature",0.954516552456762,-0.16228720030580626,0.10026950936800592
20425,Far Tortuga,Peter Matthiessen,"Fiction, Novels, Literature, Literary Fiction, Literature, American, Classics",-0.24120988294584755,-0.2742041340255165,0.10021444872071639
