,book_title,book_authors,genres,book_rating_count,book_rating,rec_score
15444,Maitreyi,Mircea Eliade,"European Literature, Romanian Literature, Classics, Romance, Fiction, Literature",-0.1920166027335116,-0.1995928448790424,0.10877407241354987
11495,Rekindled,Tamera Alexander,"Christian Fiction, Historical, Historical Fiction, Romance, Christian, Fiction, Romance, Historical Romance",-0.22098875696275896,0.4346031128659843,0.1087329971799593
8124,Sweet Thursday,"John Steinbeck, Robert DeMott","Fiction, Classics, Literature",-0.20183806925620956,0.3972974682927481,0.10863620233918353
3,Gone Girl,Gillian Flynn,"Fiction, Mystery, Thriller, Mystery, Crime",6.986783937858879,0.2480748899998001,0.10860768351351507
20592,The Waste Land and Other Writings,"T.S. Eliot, Mary Karr","Poetry, Classics, Fiction, Literature",-0.23484585392219004,0.8449652031715923,0.10856363232822297
15287,"King, Queen, Knave","Vladimir Nabokov, Dmitri Nabokov","Fiction, Cultural, Russia, Classics, Literature, Russian Literature, Literature",-0.23111494679045716,-0.6472605797578865,0.1084924888340264
5446,Our Mutual Friend,Charles Dickens,"Classics, Fiction, Literature",-0.15402776404348978,0.3226861791462757,0.10843899582291103
9292,Four Quartets,T.S. Eliot,"Poetry, Classics, Literature, Fiction, Literature, 20th Century",-0.19582955075505226,1.4418555163433844,0.10843316390771243
14833,Les Misérables: Volume Two,Victor Hugo,"Classics, Fiction, Cultural, France",-0.2310133723554571,1.516466805489857,0.10843229967671858
13,To Kill a Mockingbird,Harper Lee,"Classics, Fiction, Historical, Historical Fiction, Academic, School",14.396873373655446,1.0687990706110126,0.10841804716110107
6202,A Handful of Dust,Evelyn Waugh,"Fiction, Classics, Literature, European Literature, British Literature, Novels",-0.1638414171481108,-0.23689848945228026,0.10834128796247192
8,Mockingjay,Suzanne Collins,"Young Adult, Science Fiction, Dystopia, Fiction, Fantasy, Science Fiction",7.613045023560778,0.17346360085332768,0.10831205174086958
2949,Agnes Grey,"Anne Brontë, Angeline Goreau","Classics, Fiction, Romance, Literature, 19th Century",-0.0744949814384441,-1.1695396037832049,0.1083099253991417
15709,"Complete Poems, 1904-1962",E.E. Cummings,"Poetry, Classics, Literature, Fiction",-0.16895139257042144,1.3672442271969087,0.10828764365709856
2302,The Epic of Gilgamesh,"Anonymous, Andrew R. George","Classics, Poetry, Fiction, Fantasy, Mythology, Literature",0.02384469847776621,-1.1695396037832049,0.10828674225201404
6077,Tristram Shandy,"Laurence Sterne, Howard Peter Anderson","Classics, Fiction, Literature, Literature, 18th Century",-0.17664760937619509,-0.9084000917705448,0.10823645140274943
493,Moby Dick,"Herman Melville, Edward W. Said","Classics, Fiction, Literature, Adventure",1.4410698162341569,-1.8783468506747072,0.1081596005623823
2340,Native Son,Richard Wright,"Fiction, Classics, Cultural, African American, Historical, Historical Fiction, Literature",0.04855463314604963,-0.05037026658609438,0.1080761396147999
22703,Senhora,José de Alencar,"Classics, Romance, Fiction",-0.2322752393748809,-1.6918186278085232,0.1080709337035823
4003,Fathers and Sons,"Ivan Turgenev, George Reavy, Jane Costlow","Classics, Fiction, Cultural, Russia, Literature, Russian Literature, Literature",-0.02745429790630171,-0.1249815557325684,0.10806445909451329
14691,House of Glass,"Pramoedya Ananta Toer, Max Lane","Fiction, Novels, Asian Literature, Indonesian Literature, Literature, Historical, Historical Fiction, Classics, Romance, Cultural, Asia, Classics, Classic Literature, Historical",-0.23282999205834276,1.1807160043307243,0.10803911153283452
14456,The Collected Tales of Nikolai Gogol,"Nikolai Gogol, Richard Pevear, Larissa Volokhonsky","Short Stories, Fiction, Cultural, Russia, Classics, Literature, Russian Literature",-0.1966460529440912,1.3672442271969087,0.10801526808193074
17921,Lucy Gayheart,Willa Cather,"Fiction, Classics, Literature, Literature, American, Novels, Historical, Historical Fiction, Romance, Literary Fiction, Relationships, Literature, 20th Century",-0.2397761207287313,-0.3861210677452283,0.10789980806870697
4833,On the Banks of Plum Creek,"Laura Ingalls Wilder, Garth Williams","Classics, Historical, Historical Fiction, Childrens, Fiction, Young Adult",0.08300790015626172,0.7703539140251199,0.10789885302023486
3196,Trainspotting,Irvine Welsh,"Fiction, Contemporary, Classics",0.22886488210730704,0.3972974682927481,0.10787728953129784
2164,Bleak House,"Charles Dickens, Nicola Bradbury, Terry Eagleton, Hablot Knight Browne","Classics, Fiction, Literature, Literature, 19th Century",0.08631297600280209,0.061546667133615826,0.10784459095863905
522,The Unbearable Lightness of Being,"Milan Kundera, Michael Henry Heim","Fiction, Classics, Philosophy, Literature, Novels",0.8418079966970821,0.3972974682927481,0.1078287479375476
15689,"Collected Poems, 1909-1962",T.S. Eliot,"Poetry, Classics, Literature, Fiction",-0.17236976297907725,1.1434103597574885,0.10777964469446896
11522,The Death of the Heart,Elizabeth Bowen,"Fiction, Classics, Romance",-0.22312182009776024,-1.057622670063493,0.1077364466707347
17299,Two on a Tower,Thomas Hardy,"Classics, Fiction, Literature, 19th Century, European Literature, British Literature, Historical, Victorian, Romance",-0.2348419472131516,-1.057622670063493,0.10772894032852123
177,One Hundred Years of Solitude,Gabriel García Márquez,"Fiction, Classics, Magical Realism, Literature",2.2212669581786435,0.2480748899998001,0.10772112910207997
8750,One Tuesday Morning,Karen Kingsbury,"Christian, Fiction, Romance, Christian Fiction",-0.1805191580333127,1.5910780946363323,0.10771138508637766
13428,Sexus,Henry Miller,"Fiction, Classics, Literature",-0.21576939368737136,0.2480748899998001,0.10763191969069609
14048,The Man in the Gray Flannel Suit,"Sloan Wilson, Jonathan Franzen","Fiction, Classics, Novels, Literature, American, Literature",-0.23549046091353654,-0.6099549351846504,0.10762617327288648
15330,Green Mansions,W.H. Hudson,"Fiction, Classics, Fantasy, Romance, Literature",-0.2351662040633441,-0.8710944471973087,0.10756644873860588
20625,Jean de Florette & Manon of the Springs (Two Novels),"Marcel Pagnol, W.E. van Heyningen","Fiction, Cultural, France, Classics, European Literature, French Literature, Literature",-0.24074498457027035,1.1807160043307243,0.10750482363464708
12511,The Long Road Home,Danielle Steel,"Romance, Fiction",-0.2139293337302549,0.024241022560379646,0.10749952681208054
13033,The Complete Stories of Truman Capote,"Truman Capote, Reynolds Price","Short Stories, Fiction, Classics, Literature, Literature, American",-0.2267511527944931,0.8076595585983559,0.10742917578939434
323,The Princess Bride: S. Morgenstern's Classic Tale of True Love and High Adventure,William Goldman,"Fantasy, Fiction, Classics, Romance, Humor, Young Adult, Adventure, Science Fiction Fantasy, Fantasy, Fairy Tales, Humor, Comedy",2.4334676730208806,1.0314934260377764,0.10742418732196912
21050,The Complete Poems of Dorothy Parker,Dorothy Parker,"Poetry, Classics, Literature, 20th Century, Fiction",-0.2394127967881542,1.516466805489857,0.10741266448811485
597,Fiesta,"Ernest Hemingway, Colm Tóibín","Classics, Fiction, Literature, Novels",1.0327835613333456,-0.6099549351846504,0.1073911753864629
3215,The Stars My Destination,"Alfred Bester, Neil Gaiman","Science Fiction, Fiction, Classics",-0.10239279068211396,0.5092144020124599,0.10731614635496327
3471,Wives and Daughters,"Elizabeth Gaskell, Pam Morris","Classics, Fiction, Romance, Historical, Historical Fiction, Literature, 19th Century",-0.09730625551403413,0.35999182371951194,0.10719225079827238
4384,On Mystic Lake,Kristin Hannah,"Fiction, Romance, Womens Fiction, Chick Lit, Contemporary",-0.13666634907655673,-0.16228720030580626,0.1069176778657562
19397,The Rosary,Florence L. Barclay,"Classics, Romance, Fiction, European Literature, British Literature",-0.24116690914642444,-0.05037026658609438,0.10686058583262303
21562,Mumu,Ivan Turgenev,"Cultural, Russia, Classics, Literature, Russian Literature, Fiction, Short Stories",-0.21642181409679484,-0.9457057363437826,0.10682972962036014
7929,The Waste Land and Other Poems,T.S. Eliot,"Poetry, Classics, Fiction, Literature",-0.06682220488690124,0.919576492318068,0.10671578108710333
21728,Lovers and Dreamers,Nora Roberts,"Romance, Fiction, Contemporary",-0.2333261441062276,1.2553272934772002,0.10670563803646979
417,Level 6: Crime and Punishment Book and MP3 Pack (Pearson English Graded Readers),Fyodor Dostoyevsky,"Classics, Fiction, Cultural, Russia, Literature, Literature, Russian Literature",1.7396830282981746,0.8076595585983559,0.10668152373847781
4166,"Notes from Underground, White Nights, The Dream of a Ridiculous Man, and Selections from The House of the Dead","Fyodor Dostoyevsky, Andrew R. MacAndrew, Ben Marcus","Classics, Fiction, Cultural, Russia, Philosophy, Literature, Literature, Russian Literature",0.032310536964117224,0.6957426248786442,0.10663806593438394
22793,Of Time and the River: A Legend of Man's Hunger in His Youth,"Thomas Wolfe, Pat Conroy","Fiction, Classics, Literature, Literature, American",-0.24137396472546305,0.8076595585983559,0.10658188309018837
4627,"Raise High the Roof Beam, Carpenters & Seymour: An Introduction",J.D. Salinger,"Fiction, Classics, Short Stories, Literature, Literature, American",-0.07683510015248393,0.4719087574392238,0.10648874161397771
12306,The Fall of the House of Usher and Other Tales,"Edgar Allan Poe, Stephen Marlowe","Fiction, Short Stories, Classics, Gothic, Literature",-0.013886297415716994,0.5838256911589323,0.10647444997806016
10937,Precious Bane,Mary Webb,"Classics, Fiction, Historical, Historical Fiction, Romance",-0.23647104488219095,0.956882136891304,0.10644946221763382
523,A Prayer for Owen Meany,John Irving,"Fiction, Classics, Literature, Contemporary",0.7821955234791632,0.919576492318068,0.10644167801770762
17823,Rabbit Angstrom: The Four Novels,John Updike,"Fiction, Literature, Novels, Classics, Literature, American",-0.23891273803123084,1.0687990706110126,0.10638569341230446
17151,Daphnis and Chloe,"Longus, Paul Turner","Classics, Fiction, Romance, Fantasy, Mythology, Literature",-0.2358537848541137,-0.8710944471973087,0.1063472745221353
6755,Martin Eden,"Jack London, Andrew Sinclair","Classics, Fiction, Literature, American",-0.17366288367080876,1.5910780946363323,0.10634001998680398
12243,Sodom and Gomorrah,"Marcel Proust, C.K. Scott Moncrieff, Terence Kilmartin, D.J. Enright","Fiction, Classics, Cultural, France, European Literature, French Literature, Literature, Novels, Literature, 20th Century, Literary Fiction, Romance, Philosophy",-0.2273645061135319,1.4418555163433844,0.10631325914163468
2171,The Death of Ivan Ilyich,"Leo Tolstoy, Lynn Solotaroff","Classics, Fiction, Cultural, Russia, Literature, Russian Literature, Literature",0.01730486754737784,0.28538053457303625,0.1062399278619039
3318,White Nights,Fyodor Dostoyevsky,"Classics, Fiction, Cultural, Russia, Literature, Russian Literature, Short Stories, Literature",-0.12380546292193395,0.2107692454265639,0.10620857310873195
19198,Cathy's Key,"Jordan Weisman, Sean Stewart","Young Adult, Fantasy, Mystery, Fiction",-0.2375024160683454,-0.8337888026240724,0.10607654586730259
14400,Absent In The Spring,"Mary Westmacott, Agatha Christie","Fiction, Mystery, Romance, Classics",-0.20365078225005676,0.5838256911589323,0.10604523108988474
9709,Nostromo,Joseph Conrad,"Fiction, Classics, Literature",-0.19055158684408768,-0.6099549351846504,0.10603508777205545
126,The Little Prince,"Antoine de Saint-Exupéry, Katherine Woods","Classics, Fiction, Fantasy, Childrens",3.77437913641992,1.1434103597574885,0.10603342272501301
7360,The Professor,Charlotte Brontë,"Classics, Fiction, Romance, Literature, 19th Century, Historical, Victorian",-0.1828475566202371,-1.5425960495155748,0.10602530982956652
5431,We the Living,"Ayn Rand, Leonard Peikoff","Classics, Philosophy, Literature, Historical, Historical Fiction, Fiction",-0.15067580768848785,-0.3115097785987543,0.10601278378599024
7122,"Goodbye, Columbus and Five Short Stories",Philip Roth,"Fiction, Short Stories, Classics, Literature, Literature, Jewish",-0.18809817356793246,-0.4607323568917023,0.10598196806963653
14783,New Grub Street,"George Gissing, John Goode","Classics, Fiction, Historical, Victorian, Literature, 19th Century, Literature",-0.2248603056198766,-0.9457057363437826,0.10596880626189106
10458,The Subterraneans,Jack Kerouac,"Fiction, Classics, Literature",-0.19665777307120655,-1.1322339592099668,0.10595810109593339
13375,Desolation Angels,"Jack Kerouac, Joyce Johnson","Fiction, Classics, Literature",-0.20679958973505852,-0.23689848945228026,0.10595493515705037
62,Paper Towns,John Green,"Young Adult, Contemporary, Fiction, Romance",2.6232087176009897,-0.4980380014649386,0.10594819283995219
19924,Robert Frost's Poems,"Robert Frost, Louis Untermeyer","Poetry, Classics, Fiction, Literature",-0.2336191472841124,1.1807160043307243,0.10591027095008744
7531,Summer,"Edith Wharton, Candace Waid","Classics, Fiction, Romance",-0.2088232650169828,-1.206845248356441,0.1058902892593479
18987,Essential Tales and Poems,"Edgar Allan Poe, Benjamin F. Fisher","Classics, Poetry, Horror, Fiction, Short Stories",0.01143699057160524,1.3672442271969087,0.10587411902618507
5661,The Railway Children,E. Nesbit,"Classics, Childrens, Fiction",-0.06439613857401523,0.061546667133615826,0.10586393719502593
9114,The Death of Ivan Ilyich and Other Stories,"Leo Tolstoy, Richard Pevear, Larissa Volokhonsky","Fiction, Classics, Short Stories, Cultural, Russia, Literature, Russian Literature, Literature",-0.20430710936851865,0.4346031128659843,0.10586294429076995
12301,A Spy in the House of Love,Anaïs Nin,"Fiction, Adult Fiction, Erotica, Classics, Literature, Romance",-0.2258526097156464,-1.1322339592099668,0.10579789365456119
22686,Imagined Love,Diamond Drake,"Romance, Interracial Romance, Romance, Fiction",-0.24449933195623405,1.5537724500630965,0.10578156748299564
19927,The Collected Stories of Isaac Babel,"Isaac Babel, Nathalie Babel, Peter Constantine, Cynthia Ozick","Short Stories, Fiction, Cultural, Russia, Literature, Russian Literature, Classics, Literature",-0.2359280123258445,0.956882136891304,0.1057789703810979
1885,Helvetti,"Dante Alighieri, Eino Leino","Classics, Poetry, Fiction, Literature",0.2282476220792297,0.024241022560379646,0.10575714646257117
5087,The Tell-Tale Heart,Edgar Allan Poe,"Classics, Short Stories, Horror, Fiction, Gothic, Academic, School",-0.0685958507903638,0.8822708477448284,0.10575527659893727
10734,Tar Baby,Toni Morrison,"Fiction, Cultural, African American, Classics, Literature",-0.1840117559136993,-0.23689848945228026,0.10565613299541284
5169,The Good Soldier,"Ford Madox Ford, Kenneth Womack, William Baker","Fiction, Classics, Literature",-0.16726760097484353,-0.9830113809170188,0.10563246587119979
10872,The Nightingale and the Rose,Oscar Wilde,"Classics, Short Stories, Fiction, Fantasy, Romance",-0.22241079905275984,1.2553272934772002,0.10559887474276525
5632,Bluebeard,Kurt Vonnegut,"Fiction, Classics, Humor, Literature",-0.12291082655212575,0.17346360085332768,0.1054725662300437
12495,Les Misérables: Volume One,Victor Hugo,"Classics, Fiction, Cultural, France, Historical, Historical Fiction, European Literature, French Literature, Novels, Literature, Historical, Literature, 19th Century, Unfinished",-0.22199668789468266,1.4045498717701483,0.1054152387591745
4009,If Tomorrow Comes,Sidney Sheldon,"Fiction, Thriller, Mystery, Romance, Suspense",-0.038568885120731165,0.17346360085332768,0.10527060417749137
12153,A River Runs Through It,"Norman Maclean, Barry Moser","Fiction, Classics, Historical, Historical Fiction, Literature",-0.22126222659545147,0.6957426248786442,0.1052309394086403
58,The Nightingale,Kristin Hannah,"Historical, Historical Fiction, Fiction, Historical, War, World War II, War",1.4874815196111066,2.150662763234885,0.10522354335101244
596,The Sun Also Rises,Ernest Hemingway,"Classics, Fiction, Literature, Novels",1.032912482731615,-0.6099549351846504,0.10521997590796915
13804,JR,"William Gaddis, Frederick R. Karl","Fiction, Classics, Literature, Novels, Literature, American",-0.2353146590068057,1.1434103597574885,0.10514102696653757
3139,The Magus,John Fowles,"Fiction, Classics, Fantasy, Mystery, Literature",-0.08405860516460345,0.2480748899998001,0.10506316925767673
313,Rebecca,Daphne du Maurier,"Classics, Fiction, Mystery, Romance, Gothic",1.1899895330411279,0.8449652031715923,0.10502059454815701
13107,Return,"Karen Kingsbury, Gary Smalley","Christian Fiction, Christian, Fiction, Romance",-0.1930948544281276,1.7029950283560444,0.10501620949051443
10123,Martin Chuzzlewit,"Charles Dickens, Patricia Ingham, Hablot Knight Browne","Classics, Fiction, Literature",-0.19225100527581945,-0.5726492906114126,0.10492907012600797
14790,Journey into the Past,"Stefan Zweig, Anthea Bell, André Aciman","Fiction, Classics, European Literature, German Literature, Literature, 20th Century",-0.23604521359699845,-0.4980380014649386,0.1049238279421787
6902,The Waste Land,"T.S. Eliot, Michael North","Poetry, Classics, Fiction, Literature",-0.105627545765962,0.4346031128659843,0.10482603758897666
4660,Il libro dell'inquietudine di Bernardo Soares,"Fernando Pessoa, Antonio Tabucchi, Maria José de Lancastre","Fiction, Poetry, Classics, Philosophy, Literature",-0.1816833573267749,1.8522176066489924,0.10482048976411253
11213,Courting Morrow Little,Laura Frantz,"Historical, Historical Fiction, Christian Fiction, Romance, Christian, Historical, Romance, Historical Romance",-0.2275754684016089,0.8076595585983559,0.1048110137967613
9354,The Immoralist,"André Gide, Alan Sheridan, David Watson","Fiction, Cultural, France, Classics, Literature, European Literature, French Literature, Philosophy",-0.2124799446769849,-1.4679847603691007,0.10478405967599018
11855,"The Poetry of Robert Frost (Collected Poems, Complete & Unabridged)","Robert Frost, Edward Connery Lathem","Poetry, Classics, Fiction, Literature",-0.10049022338038212,0.919576492318068,0.1047457455762308
6429,Cities of the Plain,Cormac McCarthy,"Fiction, Westerns, Literature, Novels",-0.17679997102869516,0.35999182371951194,0.1046146103417552
13293,"The Border Trilogy: All the Pretty Horses, The Crossing, Cities of the Plain",Cormac McCarthy,"Fiction, Westerns, Literature, Novels, Literature, American, Historical, Historical Fiction",-0.22491109283737665,1.7029950283560444,0.10452792658912864
6083,The House at Pooh Corner,"A.A. Milne, Ernest H. Shepard","Childrens, Fiction, Classics",0.04417521231393173,1.4045498717701483,0.10450151202307054
14808,Collected Poems,Dylan Thomas,"Poetry, Classics, Fiction, Literature",-0.1878012636810092,0.8076595585983559,0.104495049844925
2173,The Death of Ivan Ilych,"Leo Tolstoy, Aylmer Maude","Classics, Fiction, Cultural, Russia, Literature, Russian Literature, Literature",0.017148599185839292,0.28538053457303625,0.10449328957585986
3994,"Absalom, Absalom!",William Faulkner,"Classics, Fiction, Literature, Literature, American",-0.10873728616057916,-0.08767591115933222,0.10449093014087228
22353,Seasons of Her Life,Fern Michaels,"Romance, Fiction",-0.2407567046973857,0.3226861791462757,0.10447505161597317
6692,"Women in Love (Brangwen Family, #2)",D.H. Lawrence,"Classics, Fiction, Literature",-0.14198338007790595,-1.206845248356441,0.1044593760410765
6078,"The Life and Opinions of Tristram Shandy, Gentleman","Laurence Sterne, Melvyn New","Classics, Fiction, Literature, Literature, 18th Century",-0.17670230330273354,-0.9084000917705448,0.10445229724706259
3894,The Mayor of Casterbridge,"Thomas Hardy, Keith Wilson","Classics, Fiction, Literature, Literature, 19th Century",-0.054180094438432434,-0.6472605797578865,0.1043414393901517
6720,Main Street,Sinclair Lewis,"Classics, Fiction, Literature",-0.158965844268108,-0.8337888026240724,0.104306976070897
10330,A Happy Death,"Albert Camus, Richard Howard","Fiction, Philosophy, Classics, Cultural, France, Literature",-0.21155405463486895,-0.6099549351846504,0.10430219657370284
4656,The Book of Disquiet,"Fernando Pessoa, Margaret Jull Costa, William  Boyd","Fiction, Poetry, Classics, Philosophy, Literature",-0.181675543908698,1.8522176066489924,0.10426696343063999
14061,You Can't Go Home Again,Thomas Wolfe,"Fiction, Classics, Literature, Novels",-0.2287474811131481,0.2480748899998001,0.10422543624780517
1148,"Candide, or Optimism","Voltaire, Theo Cuffe, Michael  Wood","Classics, Fiction, Philosophy, Cultural, France, Literature",0.497990254349,-0.8337888026240724,0.1042061703008903
11092,The Vicar of Wakefield,"Oliver Goldsmith, Arthur Friedman, Robert L. Mack","Classics, Fiction, Literature, 18th Century, Literature",-0.21260495936621573,-1.8783468506747072,0.10417797050206043
19611,Joseph and His Brothers,"Thomas Mann, John E. Woods","Fiction, Classics, European Literature, German Literature, Literature, Historical, Historical Fiction",-0.23948311755084656,1.5910780946363323,0.104158193917426
10686,Dom Casmurro,Machado de Assis,"Classics, Fiction, Romance, Cultural, Brazil",-0.18849665788985573,0.9941877814645405,0.10411575245726146
6771,V.,Thomas Pynchon,"Fiction, Literature, Classics, Novels, Literature, American",-0.17694061255407986,-0.08767591115933222,0.1040747149023801
22768,The Complete Poetry and Selected Prose,"John Donne, Charles M. Coffin, Denis Donoghue","Poetry, Classics, Literature, Fiction, Religion",-0.2307399027227646,0.9941877814645405,0.10405269571984864
15507,"Pale Horse, Pale Rider",Katherine Anne Porter,"Fiction, Short Stories, Classics, Literature, American, Literature",-0.2375375764496916,0.061546667133615826,0.10403795753726272
2014,American Pastoral,Philip Roth,"Fiction, Classics, Literature, Novels",-0.042686556447272005,-0.23689848945228026,0.10400693378268774
16506,Collected Works: Wise Blood / A Good Man is Hard to Find / The Violent Bear it Away / Everything that Rises Must Converge / Essays and Letters,"Flannery O'Connor, Sally Fitzgerald","Fiction, Short Stories, Classics, Literature, Writing, Essays",-0.2330097006741121,1.964134540368701,0.10396835406857874
18264,The Enchanted Barn,Grace Livingston Hill,"Romance, Fiction, Christian Fiction, Christian, Classics",-0.23908463322892326,1.1061047151842522,0.10394638216792794
14031,Keela,L.A. Casey,"Romance, New Adult, Romance, Contemporary Romance, Contemporary",-0.2216685243354517,0.8822708477448284,0.1039209992521121
18,The Martian,Andy Weir,"Science Fiction, Fiction",2.2051869437763267,1.5537724500630965,0.10390717728715748
15814,Petersburg,"Andrei Bely, Robert A. Maguire, John E. Malmstad","Fiction, Cultural, Russia, Literature, Russian Literature, Classics, Literature",-0.22967727786430245,-0.013064622012858192,0.10387524739215204
7667,The Sound of Waves,"Yukio Mishima, Meredith Weatherby","Fiction, Cultural, Japan, Asian Literature, Japanese Literature, Classics, Romance, Literature",-0.21126495816602264,-0.8710944471973087,0.10385388531039944
22171,Even Now / Ever After,Karen Kingsbury,"Christian Fiction, Christian, Romance, Fiction",-0.2389830587939232,1.964134540368701,0.10382006539143987
6948,Redemption,"Karen Kingsbury, Gary Smalley","Christian Fiction, Christian, Fiction, Romance",-0.1480387790875248,1.4418555163433844,0.10381166069275466
4994,La Dame aux Camélias,"Alexandre Dumas fils, David Coward","Classics, Fiction, Romance, Cultural, France, European Literature, French Literature",-0.14223731616540608,-0.013064622012858192,0.10380259653002488
7884,"Fanny Hill, or Memoirs of a Woman of Pleasure",John Cleland,"Fiction, Adult Fiction, Erotica, Classics, Literature, 18th Century, Romance",-0.20658472073794304,-2.4379315192732616,0.1037729478205536
1443,Where We Belong,Emily Giffin,"Womens Fiction, Chick Lit, Fiction, Romance",0.06397441372086618,-0.4234267123184645,0.1037662470475709
2951,What We Talk About When We Talk About Love,Raymond Carver,"Short Stories, Fiction, Classics, Literature, American, Literature, Contemporary, Literary Fiction, Literature, 20th Century, The United States Of America, Adult",-0.09574747860768708,0.8076595585983559,0.10376407130753235
270,Mulherzinhas,Louisa May Alcott,"Classics, Fiction, Historical, Historical Fiction, Young Adult, Romance, Historical, Literature, Childrens, Classics, Classic Literature, Literature, 19th Century",5.343372086902551,0.2480748899998001,0.10375535764227703
21630,Incidences,"Daniil Kharms, Andrew Bromfield","Fiction, Short Stories, Literature, Russian Literature, Classics, Humor",-0.23969017312988514,1.2180216489039608,0.10368439301143363
345,Love in the Time of Cholera,"Gabriel García Márquez, Edith Grossman","Fiction, Classics, Historical, Historical Fiction, Romance, Magical Realism",1.1188288279055103,-0.3115097785987543,0.10366694120163336
344,El amor en los tiempos del cólera,Gabriel García Márquez,"Fiction, Classics, Historical, Historical Fiction, Romance, Magical Realism",1.1188249211964718,-0.3115097785987543,0.10366694120163336
1286,J.D. Salinger's Franny and Zooey,"J.D. Salinger, Charlotte A. Alexander","Fiction, Classics, Short Stories, Literature",0.4250129295104966,-0.013064622012858192,0.10366343066416667
14207,The Poetry of Pablo Neruda,"Pablo Neruda, Ilan Stavans","Poetry, Classics, Fiction, Romance, Literature, European Literature, Spanish Literature, Literature, Latin American Literature, Cultural, Latin American, Poetry Plays, Nobel Prize",-0.18274988889427551,1.7029950283560444,0.10360766563748874
1188,North and South,Elizabeth Gaskell,"Classics, Fiction, Romance, Historical, Historical Fiction, Literature, 19th Century",0.2371861723592349,0.5465200465856962,0.10358427218972091
197,The Picture of Dorian Gray,"Oscar Wilde, Robert Mighall","Classics, Fiction, Horror, Fantasy",2.7882593610580075,0.28538053457303625,0.10352778738690235
